[
  {
    "finding_id": "F-0001",
    "type": "lost",
    "rule_id": "R-LOST-01",
    "severity": "critical",
    "statement": "Полномочие вносить предложения по объёму и содержанию внешней оценки БВА не закреплено ни за одним подразделением, при сохранении требования проводить такую оценку не реже одного раза в пять лет.",
    "evidence": [
      {
        "doc_id": "ia_charter_rev8",
        "clause": "5.6.3",
        "quote": "выносить предложения по объему и содержанию внешней оценки БВА Главному аудитору;",
        "span": [48210, 48312],
        "role": "before"
      },
      {
        "doc_id": "ia_charter_rev9",
        "clause": "11.2",
        "quote": "Внешняя оценка качества аудита проводится не реже одного раза в пять лет.",
        "span": [51002, 51068],
        "role": "requirement"
      }
    ],
    "atoms": ["a1b2c3d4e5f6", "b2c3d4e5f6a1"],
    "units": ["DKKM"],
    "trace": [
      "атом a1b2c3d4e5f6 (ред.8 §5.6.3) → владелец DKKM, canonical_id F-EXT-ASSESS-SCOPE",
      "DKKM сопоставлен с DKKM' в ред.9 (confidence 0.93: совпадение наименования + 4 общие функции)",
      "в ред.9 нет атома с canonical_id F-EXT-ASSESS-SCOPE ни у одного владельца",
      "ближайший кандидат §5.6.1 отклонён: другой объект («программы в зоне деятельности»)",
      "требование F-EXT-ASSESS-RUN (§11.2) сохранено → обязанность без владельца полномочия"
    ],
    "confidence": 0.89,
    "falsification": {
      "attempted": true,
      "survived": true,
      "counter_candidates": [
        {
          "doc_id": "ia_charter_rev9",
          "clause": "5.6.1",
          "rejected_because": "объект отличается: программы в зоне деятельности, не внешняя оценка"
        },
        {
          "doc_id": "ia_charter_rev9",
          "clause": "11.5",
          "rejected_because": "описывает корректировку объёма Главным аудитором, но не полномочие вносить предложения"
        }
      ]
    },
    "recommendation": "Закрепить полномочие за ДККМ либо за Комитетом по аудиту. Вывод носит рекомендательный характер и требует проверки ответственным сотрудником."
  },
  {
    "finding_id": "F-0002",
    "type": "weakened",
    "rule_id": "R-WEAK-01",
    "severity": "high",
    "statement": "Анализ контрольных процедур объекта аудита переведён из обязательного в дискреционный: «осуществляется» заменено на «может осуществляться».",
    "evidence": [
      {
        "doc_id": "ia_charter_rev8",
        "clause": "9.15",
        "quote": "осуществляется анализ контрольных процедур объекта аудита",
        "span": [39880, 39995],
        "role": "before"
      },
      {
        "doc_id": "ia_charter_rev9",
        "clause": "9.15",
        "quote": "может осуществляться анализ контрольных процедур объекта аудита",
        "span": [40310, 40432],
        "role": "after"
      }
    ],
    "atoms": ["c3d4e5f6a1b2", "d4e5f6a1b2c3"],
    "units": [],
    "trace": [
      "canonical_id F-CTRL-PROC-ANALYSIS присутствует в обеих редакциях",
      "модальность: осуществляется → может",
      "позиция в решётке понизилась на 1 уровень → класс weakened"
    ],
    "confidence": 0.96,
    "falsification": {
      "attempted": true,
      "survived": true,
      "counter_candidates": [
        {
          "doc_id": "ia_charter_rev9",
          "clause": "9.17",
          "rejected_because": "устанавливает достаточность объёма проверки, не восстанавливает обязательность анализа"
        }
      ]
    },
    "recommendation": null
  }
]
